{
  "schema": "eos-queue-entry/1",
  "id": "article/interrupts-polling-and-dma",
  "type": "article",
  "source": "src/content/blog/interrupts-polling-and-dma.mdx",
  "url": "https://acrr.asia/blog/interrupts-polling-and-dma",
  "title": "Interrupts, Polling and DMA",
  "format": "explainer",
  "valueCategory": "practical-implementation",
  "risk": "routine",
  "contract": {
    "status": "reconstructed",
    "reader": "A C programmer who knows a microcontroller's registers and the superloop (entry 1) and needs peripheral data to reach the program without loss",
    "problem": "Choosing between polling, interrupts and DMA for a given input, and writing interrupt code that neither misses deadlines nor corrupts shared data",
    "outcome": "Compute polling latency, worst-case interrupt latency and the processor load of interrupt-per-item and DMA handling; follow the ISR rules; recognize races and torn reads; protect shared data with a short critical section or an SPSC ring buffer; set up double buffering and know its deadline and delay; pick a method from the decision table",
    "contribution": "One quantitative thread (the 115 200 bit/s UART and its 86.8 us deadline, the 10 kHz ADC) carried through all three methods; a C11 ring buffer with correct acquire/release ordering and real test output; a decision table and four worked design decisions",
    "evidence": "Worked arithmetic; the ring-buffer program and load-comparison script with real output; Arm DDI 0403E.e, ISO/IEC 9899:2011, Ganssle (2008), Lee and Seshia (2017), White (2011), Yiu (2014)",
    "limitations": "Generic Cortex-M at 48 MHz with invented register names; vendor DMA specifics, multicore concurrency and OS primitives out of scope",
    "approvedBy": null,
    "approvedAt": null
  },
  "status": "accepted",
  "reviews": {
    "technical": {
      "status": "pass",
      "ref": "editorial/records/article/interrupts-polling-and-dma.json"
    },
    "editorial": {
      "status": "pass",
      "ref": "editorial/records/article/interrupts-polling-and-dma.json"
    },
    "chiefEditor": {
      "status": "accepted-with-follow-up",
      "by": "Claude",
      "at": "2026-10-24",
      "ref": "editorial/live-reviews/article/interrupts-polling-and-dma.md"
    }
  },
  "findings": [
    {
      "id": "L1",
      "location": "Section 3.1 sequence diagram; Section 5.2 double-buffering flowchart (mobile-light-27)",
      "problem": "Neither Mermaid diagram has a caption; at 360 px the flowchart's last node is cut off with no scroll cue",
      "whyItMatters": "A caption tells the reader what to notice and gives the phone reader the cut destination in words",
      "action": "Add a one-sentence caption to each diagram; consider flowchart TB so the flowchart fits at 360 px",
      "priority": "minor",
      "acceptance": "facts.json of new captures reports 0 SVG figures without a title and both diagrams have a caption",
      "status": "open",
      "opened": "2026-10-24",
      "closed": null
    },
    {
      "id": "L2",
      "location": "Section 7, Exercise 3, inline code ((uint64_t)ticks_high << 32) | TIMER->COUNT (desktop-light-20)",
      "problem": "At 1280 px the inline code wraps at the hyphen, splitting the -> operator into TIMER- and >COUNT",
      "whyItMatters": "The exercise asks the reader to diagnose this exact expression; a split operator reads as a subtraction",
      "action": "Keep TIMER->COUNT unbroken (word joiner, code block, or a site-level rule against breaking inline code after a hyphen)",
      "priority": "minor",
      "acceptance": "On new captures at 1280 and 360 px TIMER->COUNT appears on one line",
      "status": "open",
      "opened": "2026-10-24",
      "closed": null
    },
    {
      "id": "L3",
      "location": "Section 3.5, '11 520 bytes/s' and '100 000 items per second' (mobile-light-16)",
      "problem": "Digit-group spaces are breaking spaces, so grouped numbers split across lines at 360 px",
      "whyItMatters": "A split number reads as two numbers",
      "action": "Non-breaking (narrow) spaces in grouped numbers, preferably by the site-wide step proposed in the Inside a Microcontroller review (L4)",
      "priority": "minor",
      "acceptance": "Neither split appears on new captures at 360 px",
      "status": "open",
      "opened": "2026-10-24",
      "closed": null
    }
  ],
  "author": null,
  "reviewers": [
    "author (wave 1 revision and resolution)",
    "independent reviewer (fact-check, technical, series)",
    "QA editor (final gate)"
  ],
  "disclosures": [],
  "history": [
    {
      "at": "2026-10-23",
      "status": "published-awaiting-live-review",
      "by": "eos queue init",
      "note": "seeded from review record of 2026-10-15 (publish 27/28)"
    },
    {
      "at": "2026-10-24",
      "status": "accepted",
      "from": "published-awaiting-live-review",
      "by": "Claude",
      "note": "live review: accepted-with-follow-up (editorial/live-reviews/article/interrupts-polling-and-dma.md); library decision: retain"
    }
  ]
}
