{
  "schema": "eos-queue-entry/1",
  "id": "article/serial-buses-uart-spi-i2c-and-can",
  "type": "article",
  "source": "src/content/blog/serial-buses-uart-spi-i2c-and-can.mdx",
  "url": "https://acrr.asia/blog/serial-buses-uart-spi-i2c-and-can",
  "title": "Serial Buses: UART, SPI, I2C and CAN",
  "format": null,
  "valueCategory": null,
  "risk": null,
  "contract": {
    "status": "missing",
    "reader": null,
    "problem": null,
    "outcome": null,
    "contribution": null,
    "evidence": null,
    "limitations": null,
    "approvedBy": null,
    "approvedAt": null
  },
  "status": "published-awaiting-live-review",
  "reviews": {
    "technical": {
      "status": "pass",
      "ref": "editorial/records/article/serial-buses-uart-spi-i2c-and-can.json"
    },
    "editorial": {
      "status": "pass",
      "ref": "editorial/records/article/serial-buses-uart-spi-i2c-and-can.json"
    },
    "chiefEditor": {
      "status": "none",
      "by": null,
      "at": null,
      "ref": null
    }
  },
  "findings": [],
  "author": null,
  "reviewers": [
    "author (wave 1 revision and resolution)",
    "independent reviewer (fact-check, technical, series)",
    "QA editor (final gate)"
  ],
  "disclosures": [],
  "history": [
    {
      "at": "2026-10-23",
      "status": "published-awaiting-live-review",
      "by": "eos queue init",
      "note": "seeded from review record of 2026-10-15 (publish 28/28)"
    }
  ]
}
