{
  "schema": "eos-queue-entry/1",
  "id": "article/sampling-quantization-and-data-conversion",
  "type": "article",
  "source": "src/content/blog/sampling-quantization-and-data-conversion.mdx",
  "url": "https://acrr.asia/blog/sampling-quantization-and-data-conversion",
  "title": "Sampling, Quantization and Data Conversion",
  "format": "explainer",
  "valueCategory": "conceptual-understanding",
  "risk": "routine",
  "contract": {
    "status": "reconstructed",
    "reader": "An engineering student or engineer following the Sensor Systems series who has a conditioned analog voltage and needs to know what the converter does to it",
    "problem": "Choosing a sampling rate, an anti-aliasing filter and a converter resolution and architecture, and knowing what errors each contributes",
    "outcome": "Explain aliasing and the sampling theorem, size an anti-aliasing filter against the converter's resolution, compute the quantization step, its uncertainty and the ideal SQNR, read static and dynamic converter specifications (INL, DNL, SINAD, ENOB, jitter) and choose between SAR, delta-sigma and other architectures",
    "contribution": "Ties sampling and quantization to the series' running load-cell channel and to the GUM rectangular-distribution uncertainty of entry 1, with worked numbers at each step",
    "evidence": "Derivations and worked numbers in the text; one generated figure; IEEE Std 1241-2023, Kester (2005), Oppenheim and Schafer (2010), Pallas-Areny and Webster (2001)",
    "limitations": "Delta-sigma noise shaping treated qualitatively; no code; DAC covered in one paragraph",
    "approvedBy": null,
    "approvedAt": null
  },
  "status": "accepted",
  "reviews": {
    "technical": {
      "status": "pass",
      "ref": "editorial/records/article/sampling-quantization-and-data-conversion.json"
    },
    "editorial": {
      "status": "pass",
      "ref": "editorial/records/article/sampling-quantization-and-data-conversion.json"
    },
    "chiefEditor": {
      "status": "accepted-with-follow-up",
      "by": "Claude",
      "at": "2026-10-24",
      "ref": "editorial/live-reviews/article/sampling-quantization-and-data-conversion.md"
    }
  },
  "findings": [
    {
      "id": "L1",
      "location": "Section 1.1, aliasing figure at 360 px (mobile-light-05, mobile-dark-05)",
      "problem": "At 360 px the figure's axis labels and legend are about 6 px high, and its right edge (last sample at t = 1 s, end of the legend) is cut.",
      "whyItMatters": "The caption repeats the key, but the figure's own labels are unreadable on a phone.",
      "action": "In scripts/generate-diagrams.py move the legend into the caption or onto two lines and raise the label size so it renders at least at caption size at 360 px; regenerate.",
      "priority": "minor",
      "acceptance": "At 360 px every label of the figure is legible at caption size and the legend is fully visible.",
      "status": "open",
      "opened": "2026-10-24",
      "closed": null
    },
    {
      "id": "L2",
      "location": "Section 3.3 SQNR display (mobile-light-14); Section 1.1 identity (mobile-light-04)",
      "problem": "At 360 px the SQNR display ends at '≈ 6.0', hiding the result 6.02 N + 1.76 dB; the conclusion of the 1.1 identity is also cut.",
      "whyItMatters": "The display the section exists for shows no result on a phone (it is restated in prose and in the summary).",
      "action": "Put 'SQNR ≈ 6.02 N + 1.76 dB' on its own line (aligned block) and split the 1.1 identity at its second equals sign.",
      "priority": "minor",
      "acceptance": "At 360 px the full SQNR approximation and the conclusion of the 1.1 identity are visible without sideways scrolling.",
      "status": "open",
      "opened": "2026-10-24",
      "closed": null
    },
    {
      "id": "L3",
      "location": "Sections 3.2, 3.4 and 4.1 ('the first entry')",
      "problem": "The three references to the series' first entry, Measurement Systems and Sensor Characteristics, are plain text, including the one that relies on its Type B uncertainty.",
      "whyItMatters": "A reader arriving from search or from the DSP series cannot tell which page is meant.",
      "action": "Link the first mention in 3.2 to /blog/measurement-systems-and-sensor-characteristics#52-evaluating-uncertainty.",
      "priority": "minor",
      "acceptance": "On the live page 'the first entry' in Section 3.2 is a working link to the first entry of Sensor Systems.",
      "status": "open",
      "opened": "2026-10-24",
      "closed": null
    }
  ],
  "author": null,
  "reviewers": [
    "author (wave 1 revision and resolution)",
    "independent reviewer (fact-check, technical, series)",
    "QA editor (final gate)"
  ],
  "disclosures": [],
  "history": [
    {
      "at": "2026-10-23",
      "status": "published-awaiting-live-review",
      "by": "eos queue init",
      "note": "seeded from review record of 2026-10-15 (publish 28/28)"
    },
    {
      "at": "2026-10-24",
      "status": "accepted",
      "from": "published-awaiting-live-review",
      "by": "Claude",
      "note": "live review: accepted-with-follow-up (editorial/live-reviews/article/sampling-quantization-and-data-conversion.md); library decision: retain"
    }
  ]
}
