{
  "schema": "eos-queue-entry/1",
  "id": "article/signals-and-systems-in-discrete-time",
  "type": "article",
  "source": "src/content/blog/signals-and-systems-in-discrete-time.mdx",
  "url": "https://acrr.asia/blog/signals-and-systems-in-discrete-time",
  "title": "Signals and Systems in Discrete Time",
  "format": "explainer",
  "valueCategory": "conceptual-understanding",
  "risk": "routine",
  "contract": {
    "status": "reconstructed",
    "reader": "An engineering student or engineer with calculus, complex numbers and the idea of sampling, starting the DSP series with samples already in memory",
    "problem": "Knowing what frequency means for a sequence and which systems can be analyzed, and describing such a system by a difference equation and an impulse response",
    "outcome": "Convert hertz to radians per sample and explain discrete-time aliasing; test linearity, time invariance, causality, memory and BIBO stability; run a difference equation in the series' sign convention; convolve by hand; read causality, stability and DC gain from h[n]; compute a first frequency response",
    "contribution": "One compact path from sequences to frequency response that fixes the notation and sign conventions of the whole series, with two running examples (moving average, exponential smoother), a mains-interference example and two scripts with output",
    "evidence": "Derivations in the text; two Python/NumPy scripts with output; Oppenheim and Schafer (2010), Oppenheim, Willsky and Nawab (1997), Proakis and Manolakis (2007)",
    "limitations": "No z-transform, DFT, filter design or finite word length (later entries); sample values treated as unquantized",
    "approvedBy": null,
    "approvedAt": null
  },
  "status": "revision-required-after-publication",
  "reviews": {
    "technical": {
      "status": "pass",
      "ref": "editorial/records/article/signals-and-systems-in-discrete-time.json"
    },
    "editorial": {
      "status": "pass",
      "ref": "editorial/records/article/signals-and-systems-in-discrete-time.json"
    },
    "chiefEditor": {
      "status": "revision-requested",
      "by": "Claude",
      "at": "2026-10-23",
      "ref": "editorial/live-reviews/article/signals-and-systems-in-discrete-time.md"
    }
  },
  "findings": [
    {
      "id": "L1",
      "location": "Section 6.2 derivation of H (1280 and 360 px); at 360 px also Sections 2.2, 3.1, 4.2, 6.1 and 6.3 display equations",
      "problem": "Display equations are wider than the column and scroll sideways with no cue; at 1280 px the 6.2 result (1 + 2cos w)e^{-jw} is hidden, at 360 px most central equations show only their left part",
      "whyItMatters": "These are the results the sections derive (difference-equation convention, convolution sum, frequency response, the mains-rejecting zero); readers see incomplete formulas where the argument depends on them",
      "action": "Break the long equations over lines (aligned blocks; one form per line for 3.1 and 4.2)",
      "priority": "major",
      "acceptance": "On new captures the 6.2 equation is fully visible at 1280 px and no line of the listed equations is cut at 360 px, light and dark",
      "status": "open",
      "opened": "2026-10-23",
      "closed": null
    },
    {
      "id": "L2",
      "location": "Section 3.2, Mermaid diagram of the exponential smoother (360 px)",
      "problem": "The delay, the x a block and the feedback arrow are off-screen at 360 px with no scroll cue; no caption",
      "whyItMatters": "The feedback loop is the point of the diagram",
      "action": "Top-to-bottom layout or site-level scroll cue, and a one-sentence caption",
      "priority": "minor",
      "acceptance": "At 360 px the feedback path is visible or a cue shows the figure scrolls; the figure has a caption",
      "status": "open",
      "opened": "2026-10-23",
      "closed": null
    },
    {
      "id": "L3",
      "location": "Section 2.2, system-properties table (1280 and 360 px)",
      "problem": "BIBO stable column cut under the scroll shadow at 1280 px; only three of six columns visible at 360 px",
      "whyItMatters": "The table summarizes Section 2.2 and the stability column feeds Section 5",
      "action": "Shorten headers (Stable) and consider transposing the table",
      "priority": "minor",
      "acceptance": "All six columns visible at 1280 px; every cell readable at 360 px without discovering a sideways scroll",
      "status": "open",
      "opened": "2026-10-23",
      "closed": null
    },
    {
      "id": "L4",
      "location": "Section 4.3, difference_equation script",
      "problem": "Code-font ligature draws Python >= as a single ≥ glyph",
      "whyItMatters": "A reader retyping the script types a character Python rejects",
      "action": "Site-level: disable ligatures for code in prose.css (see inside-a-microcontroller L1); no article change",
      "priority": "minor",
      "acceptance": ">= shows as two characters in Section 4.3 on new captures",
      "status": "open",
      "opened": "2026-10-23",
      "closed": null
    },
    {
      "id": "L5",
      "location": "Section 7, Exercise 5",
      "problem": "The question asks how many samples the step response takes to reach 95%; the answer gives the index n = 59 (the 60th sample)",
      "whyItMatters": "A reader who counts samples answers 60 and thinks they are wrong",
      "action": "Ask for the index, or give both index and count in the answer",
      "priority": "minor",
      "acceptance": "Question and answer of Exercise 5 refer to the same quantity",
      "status": "open",
      "opened": "2026-10-23",
      "closed": null
    }
  ],
  "author": null,
  "reviewers": [
    "author (wave 1 revision and resolution)",
    "independent reviewer (fact-check, technical, series)",
    "QA editor (final gate)"
  ],
  "disclosures": [],
  "history": [
    {
      "at": "2026-10-23",
      "status": "published-awaiting-live-review",
      "by": "eos queue init",
      "note": "seeded from review record of 2026-10-15 (publish 26/28)"
    },
    {
      "at": "2026-10-23",
      "status": "revision-required-after-publication",
      "from": "published-awaiting-live-review",
      "by": "Claude",
      "note": "live review: revision-requested (editorial/live-reviews/article/signals-and-systems-in-discrete-time.md); library decision: retain; major finding L1 (cut display equations)"
    }
  ]
}
