{
  "schema": "eos-queue-entry/1",
  "id": "series/motion-planning",
  "type": "series",
  "source": "src/content/series/motion-planning.md",
  "url": "https://acrr.asia/series/motion-planning",
  "title": "Motion Planning for Robots",
  "format": null,
  "valueCategory": null,
  "risk": null,
  "contract": {
    "status": "missing",
    "reader": null,
    "problem": null,
    "outcome": null,
    "contribution": null,
    "evidence": null,
    "limitations": null,
    "approvedBy": null,
    "approvedAt": null
  },
  "status": "published-awaiting-live-review",
  "reviews": {
    "technical": {
      "status": "n/a",
      "ref": "editorial/records/series/motion-planning.json"
    },
    "editorial": {
      "status": "pass",
      "ref": "editorial/records/series/motion-planning.json"
    },
    "chiefEditor": {
      "status": "none",
      "by": null,
      "at": null,
      "ref": null
    }
  },
  "findings": [],
  "author": null,
  "reviewers": [
    "series editor (independent agent; developmental, copy, series and cross-entry fact checks of the overview)",
    "author (resolution)",
    "qa-editor (independent agent)"
  ],
  "disclosures": [],
  "history": [
    {
      "at": "2026-10-23",
      "status": "published-awaiting-live-review",
      "by": "eos queue init",
      "note": "seeded from review record of 2026-10-17 (publish 28/28)"
    }
  ]
}
