{
  "schema": "eos-queue-entry/1",
  "id": "article/graph-search-dijkstra-and-a-star",
  "type": "article",
  "source": "src/content/blog/graph-search-dijkstra-and-a-star.mdx",
  "url": "https://acrr.asia/blog/graph-search-dijkstra-and-a-star",
  "title": "Planning on Graphs: Dijkstra's Algorithm and A*",
  "format": "explainer",
  "valueCategory": "conceptual-understanding",
  "risk": "routine",
  "contract": {
    "status": "reconstructed",
    "reader": "An engineer or student who has read entry 1, knows what a graph and a queue are and reads Python",
    "problem": "Planning on a discretized configuration space and knowing which search to use, what it guarantees and what it costs",
    "outcome": "Build a grid or visibility graph; run and prove Dijkstra's algorithm; choose an admissible and consistent heuristic; predict the effect of weights, any-angle search and incremental replanning; see why grids do not scale with dimension",
    "contribution": "One 15 by 26 map on which every search is run and counted, short proofs of optimality and of the weighted bound, and a measured arm grid on the torus",
    "evidence": "Proofs in the text, programs with real output, Dijkstra 1959, Hart et al. 1968, Pohl 1970, Koenig and Likhachev 2002, Nash et al. 2007, Harabor and Grastien 2011 and others (numbers recomputed in the 2026-10-24 live review)",
    "limitations": "Uniform-cost grids in the measurements; D* Lite described without its bookkeeping; counts depend on tie-breaking",
    "approvedBy": null,
    "approvedAt": null
  },
  "status": "accepted",
  "reviews": {
    "technical": {
      "status": "pass",
      "ref": "editorial/records/article/graph-search-dijkstra-and-a-star.json"
    },
    "editorial": {
      "status": "pass",
      "ref": "editorial/records/article/graph-search-dijkstra-and-a-star.json"
    },
    "chiefEditor": {
      "status": "accepted-with-follow-up",
      "by": "Claude",
      "at": "2026-10-24",
      "ref": "editorial/live-reviews/article/graph-search-dijkstra-and-a-star.md"
    }
  },
  "findings": [
    {
      "id": "L1",
      "location": "Section 4.3, 'the source of A*'s savings'; desktop-light-14, mobile-light-25",
      "problem": "Apostrophe after the asterisk is typeset as a left single quotation mark (A*‘s)",
      "whyItMatters": "Visible typographic error in running text",
      "action": "Write U+2019 in the source or rephrase (the savings of A*)",
      "priority": "minor",
      "acceptance": "Correct apostrophe or no possessive on new captures",
      "status": "open",
      "opened": "2026-10-24",
      "closed": null
    },
    {
      "id": "L2",
      "location": "Section 5.1, chain from C = f_w(goal) to w C*; desktop-light-19",
      "problem": "Chain cut at 1280 px before its last term w C*",
      "whyItMatters": "Small: the result C <= w C* is displayed on its own just above",
      "action": "Split the chain over two lines",
      "priority": "minor",
      "acceptance": "Chain fully visible at 1280 px",
      "status": "open",
      "opened": "2026-10-24",
      "closed": null
    },
    {
      "id": "L3",
      "location": "Sections 4.2, 4.3, 4.4: optimality chain, reduced-cost telescoping sum, h_oct; mobile-light-23, 24, 26",
      "problem": "Each equation ends mid-expression at 360 px with no scroll cue",
      "whyItMatters": "The first two are the steps the optimality and consistency arguments rest on",
      "action": "Break each over two lines, or rely on the site-level scroll cue when it ships",
      "priority": "minor",
      "acceptance": "At 360 px each equation fully visible or with a visible scroll cue",
      "status": "open",
      "opened": "2026-10-24",
      "closed": null
    }
  ],
  "author": null,
  "reviewers": [
    "developmental and copy editor (independent agent)",
    "fact-checker (independent agent)",
    "technical reviewer (independent agent)",
    "series editor (independent agent)",
    "author (resolution)",
    "qa-editor (independent agent)"
  ],
  "disclosures": [],
  "history": [
    {
      "at": "2026-10-23",
      "status": "published-awaiting-live-review",
      "by": "eos queue init",
      "note": "seeded from review record of 2026-10-17 (publish 26/28)"
    },
    {
      "at": "2026-10-24",
      "status": "accepted",
      "from": "published-awaiting-live-review",
      "by": "Claude",
      "note": "live review: accepted-with-follow-up (editorial/live-reviews/article/graph-search-dijkstra-and-a-star.md); library decision: retain"
    }
  ]
}
