{
  "schema": "eos-queue-entry/1",
  "id": "article/fieldbuses-and-industrial-ethernet",
  "type": "article",
  "source": "src/content/blog/fieldbuses-and-industrial-ethernet.mdx",
  "url": "https://acrr.asia/blog/fieldbuses-and-industrial-ethernet",
  "title": "Fieldbuses and Industrial Ethernet",
  "format": "explainer",
  "valueCategory": "technical-decision",
  "risk": "routine",
  "contract": {
    "status": "reconstructed",
    "reader": "An engineer or student who has followed entry 2 (scan cycle, response time) and now meets distributed I/O, drives and plant networks",
    "problem": "Why a control network must be deterministic, and how fieldbuses and industrial Ethernet systems achieve or fail to achieve bounded latency and jitter",
    "outcome": "Compute a Modbus RTU poll cycle and a CAN frame's worst case and bus load; trace CAN arbitration; compute Ethernet frame times and switch blocking; explain PROFINET RT/IRT, EtherCAT, POWERLINK, PTP and TSN; choose an approach by timing need",
    "contribution": "One timing argument carried from serial polling to TSN, each step with numbers reproduced by runnable code, and a comparison organized by where determinism comes from",
    "evidence": "Three Python programs with real output; Davis et al. (2007); IEC 61158, IEC 61784-1-0/-2-0:2023, IEC/IEEE 60802:2026, IEC 61131-9, IEEE 1588, 802.1AS, 802.1Q, 802.3, ISO 11898-1:2024, Modbus specifications",
    "limitations": "Protocol survey, not an implementation guide; product-dependent parameters labeled; no wireless; network security deferred to entry 5",
    "approvedBy": null,
    "approvedAt": null
  },
  "status": "accepted",
  "reviews": {
    "technical": {
      "status": "pass",
      "ref": "editorial/records/article/fieldbuses-and-industrial-ethernet.json"
    },
    "editorial": {
      "status": "pass",
      "ref": "editorial/records/article/fieldbuses-and-industrial-ethernet.json"
    },
    "chiefEditor": {
      "status": "accepted-with-follow-up",
      "by": "Claude",
      "at": "2026-10-25",
      "ref": "editorial/live-reviews/article/fieldbuses-and-industrial-ethernet.md"
    }
  },
  "findings": [
    {
      "id": "L1",
      "location": "Section 8.2, second display equation (mobile-light-35)",
      "problem": "At 360 px only theta is visible; the path-delay formula d is off-screen with no scroll cue",
      "whyItMatters": "d is one of the section's two results and the summary restates only theta; recoverable from the example, so minor",
      "action": "Put theta and d (and the pair above) on separate lines",
      "priority": "minor",
      "acceptance": "At 360 px both the theta and d formulas are fully visible",
      "status": "open",
      "opened": "2026-10-25",
      "closed": null
    },
    {
      "id": "L2",
      "location": "Section 4, CAN (desktop-light-09 to 11); compare serial-buses-uart-spi-i2c-and-can Sections 5.3-5.7",
      "problem": "Arbitration, the worst-case stuffing bound, the 135-bit/270 us numbers and Davis et al. are derived on both pages; neither links to the other",
      "whyItMatters": "Readers do not learn a fuller derivation exists, and two explanations of one result can drift apart",
      "action": "Link to serial-buses-uart-spi-i2c-and-can from Section 4 for the bit-level derivation; optionally trim Section 4.2; record the pair in the overlap map",
      "priority": "minor",
      "acceptance": "The live page links to the serial-buses article from Section 4",
      "status": "open",
      "opened": "2026-10-25",
      "closed": null
    },
    {
      "id": "L3",
      "location": "Section 8.2 PTP sequence diagram (desktop-light-18)",
      "problem": "No caption or accessible title (facts.json: 1 SVG figure without title); two labels touch the lifelines",
      "whyItMatters": "The caption should say which clock reads which time stamp, which the next paragraph relies on; screen-reader users get nothing",
      "action": "Add accTitle/accDescr and a caption naming which clock reads t1-t4",
      "priority": "minor",
      "acceptance": "Visible caption under the diagram and facts.json reports 0 SVG figures without title",
      "status": "open",
      "opened": "2026-10-25",
      "closed": null
    }
  ],
  "author": null,
  "reviewers": [
    "author (wave 1 revision and resolution)",
    "independent reviewer (fact-check, technical, series)",
    "QA editor (final gate)"
  ],
  "disclosures": [],
  "history": [
    {
      "at": "2026-10-23",
      "status": "published-awaiting-live-review",
      "by": "eos queue init",
      "note": "seeded from review record of 2026-10-15 (publish 27/28)"
    },
    {
      "at": "2026-10-25",
      "status": "accepted",
      "from": "published-awaiting-live-review",
      "by": "Claude",
      "note": "live review: accepted-with-follow-up (editorial/live-reviews/article/fieldbuses-and-industrial-ethernet.md); library decision: retain and update (cross-link to serial-buses-uart-spi-i2c-and-can); routine risk; L1-L3 open (minor)"
    }
  ]
}
