{
  "schema": "eos-queue-entry/1",
  "id": "article/sensing-and-state-estimation",
  "type": "article",
  "source": "src/content/blog/sensing-and-state-estimation.mdx",
  "url": "https://acrr.asia/blog/sensing-and-state-estimation",
  "title": "Sensing and State Estimation: An Overview",
  "format": "explainer",
  "valueCategory": "conceptual-understanding",
  "risk": "routine",
  "contract": {
    "status": "reconstructed",
    "reader": "A student or engineer with the series geometry and kinematics and only basic probability, who needs to understand how a robot knows where it is",
    "problem": "Kinematics and transforms assume known poses, but sensors are indirect, noisy, biased, late and partial; the reader needs a principled way to combine a model with measurements and to state how good the result is",
    "outcome": "Describe a belief by mean and covariance; explain predict-update and the Bayes filter; compute a 1D Kalman update and prediction by hand; read the matrix Kalman filter and its assumptions; choose among KF, EKF, UKF and particle filter; apply frames, time stamps, angle wrapping, gating, tuning and initialization",
    "contribution": "One hand-checkable corridor example from Gaussian update through prediction to gating and exercises, plus the engineering details that decide whether an estimator works, tied to the series frames material",
    "evidence": "Derivations and worked numbers; fusion figure computed from the example; three exercises; Bar-Shalom et al. (2001), Durrant-Whyte and Bailey (2006), Julier and Uhlmann (1997), Kalman (1960), Thrun et al. (2005)",
    "limitations": "EKF, UKF, particle filters and SLAM described, not derived; no code; Kalman optimality stated, not proved",
    "approvedBy": null,
    "approvedAt": null
  },
  "status": "revision-required-after-publication",
  "reviews": {
    "technical": {
      "status": "pass",
      "ref": "editorial/records/article/sensing-and-state-estimation.json"
    },
    "editorial": {
      "status": "pass",
      "ref": "editorial/records/article/sensing-and-state-estimation.json"
    },
    "chiefEditor": {
      "status": "revision-requested",
      "by": "Claude",
      "at": "2026-10-24",
      "ref": "editorial/live-reviews/article/sensing-and-state-estimation.md"
    }
  },
  "findings": [
    {
      "id": "L1",
      "location": "Section 4 displays (desktop-light-07; mobile-light-13, 15) and Section 5.1 displays (mobile-light-15, 16)",
      "problem": "The fused variance P = 0.066 m^2 is hidden at 1280 px; at 360 px the mean and variance updates of Section 4, the measurement model and both covariance equations of the Kalman filter are hidden",
      "whyItMatters": "The variance update is what makes estimation more than averaging and the covariance equations are half of the Kalman filter; Exercise 2 starts from the hidden value",
      "action": "One equation per line for the three Section 4 displays; in 5.1 put the model equations on separate lines and stack predict and update in one column; keep the heading text of Sections 4, 5, 7.1 and 8 (inbound fragment links)",
      "priority": "major",
      "acceptance": "On new captures P = 0.066 m^2 is visible at 1280 px and every listed equation is fully visible at 360 px, light and dark",
      "status": "open",
      "opened": "2026-10-24",
      "closed": null
    }
  ],
  "author": null,
  "reviewers": [
    "author (wave 1 revision and resolution)",
    "independent reviewer (fact-check, technical, series)",
    "QA editor (final gate)"
  ],
  "disclosures": [],
  "history": [
    {
      "at": "2026-10-23",
      "status": "published-awaiting-live-review",
      "by": "eos queue init",
      "note": "seeded from review record of 2026-10-15 (publish 27/28)"
    },
    {
      "at": "2026-10-24",
      "status": "revision-required-after-publication",
      "from": "published-awaiting-live-review",
      "by": "Claude",
      "note": "live review: revision-requested (editorial/live-reviews/article/sensing-and-state-estimation.md); library decision: retain and update"
    }
  ]
}
