{
  "schema": "eos-queue-entry/1",
  "id": "article/sampling-the-posterior-mcmc",
  "type": "article",
  "source": "src/content/blog/sampling-the-posterior-mcmc.mdx",
  "url": "https://acrr.asia/blog/sampling-the-posterior-mcmc",
  "title": "Sampling the Posterior: From HMC to Stochastic-Gradient MCMC",
  "format": null,
  "valueCategory": null,
  "risk": null,
  "contract": {
    "status": "missing",
    "reader": null,
    "problem": null,
    "outcome": null,
    "contribution": null,
    "evidence": null,
    "limitations": null,
    "approvedBy": null,
    "approvedAt": null
  },
  "status": "published-awaiting-live-review",
  "reviews": {
    "technical": {
      "status": "pass",
      "ref": "editorial/records/article/sampling-the-posterior-mcmc.json"
    },
    "editorial": {
      "status": "pass",
      "ref": "editorial/records/article/sampling-the-posterior-mcmc.json"
    },
    "chiefEditor": {
      "status": "none",
      "by": null,
      "at": null,
      "ref": null
    }
  },
  "findings": [],
  "author": null,
  "reviewers": [
    "author (drafting and resolution)",
    "independent reviewers (first wave: developmental, copy, fact-check, technical)",
    "independent series reviewer (second pass)",
    "independent QA verifier (third pass, final gate)"
  ],
  "disclosures": [],
  "history": [
    {
      "at": "2026-10-23",
      "status": "published-awaiting-live-review",
      "by": "eos queue init",
      "note": "seeded from review record of 2026-10-22 (publish 27/28)"
    }
  ]
}
