{
  "schema": "eos-queue-entry/1",
  "id": "article/informative-priors",
  "type": "article",
  "source": "src/content/blog/informative-priors.mdx",
  "url": "https://acrr.asia/blog/informative-priors",
  "title": "Informative Priors",
  "format": null,
  "valueCategory": null,
  "risk": null,
  "contract": {
    "status": "missing",
    "reader": null,
    "problem": null,
    "outcome": null,
    "contribution": null,
    "evidence": null,
    "limitations": null,
    "approvedBy": null,
    "approvedAt": null
  },
  "status": "published-awaiting-live-review",
  "reviews": {
    "technical": {
      "status": "pass",
      "ref": "editorial/records/article/informative-priors.json"
    },
    "editorial": {
      "status": "pass",
      "ref": "editorial/records/article/informative-priors.json"
    },
    "chiefEditor": {
      "status": "none",
      "by": null,
      "at": null,
      "ref": null
    }
  },
  "findings": [],
  "author": null,
  "reviewers": [
    "converter (full-text conversion)",
    "independent QA editor (fidelity check against the PDF)"
  ],
  "disclosures": [],
  "history": [
    {
      "at": "2026-10-23",
      "status": "published-awaiting-live-review",
      "by": "eos queue init",
      "note": "seeded from review record of 2026-10-23 (publish 27/28)"
    }
  ]
}
